{  
   "id":"2",
   "firstName":"Harris",
   "lastName":"Keeling",
   "email":"Darby_Leffler68@gmail.com",
   "address":{  
      "street":"193 Talon Valley",
      "city":"South Tate furt",
      "zip":"47069",
      "state":"IA",
      "country":"US"
   },
   "dateCreated":"2016-03-15T07:02:40.896Z",
   "company":{  
      "name":"Denesik Group",
      "website":"http://jodie.org"
   },
   "profilePic":"http://lorempixel.com/640/480/people"
}
